X	Y	concept	definition	id
30	5	cognitive heuristic	are simple, efficient rules, hard-coded by evolutionary processes or learned, which have been proposed to explain how people make decisions, come to judgments, and solve problems, typically when facing complex problems or incomplete information. These rules work well under most circumstances, but in certain cases lead to systematic errors or cognitive biases.	trm_4a3fd79d09d58
1	6	cognitive load	The amount of demand placed on working memory, typically expressed along some continuum and within a theoretical maximum.	trm_4a3fd79d09d64
2	6	cognitive map	a type of mental processing composed of a series of psychological transformations by which an individual can acquire, code, store, recall, and decode information about the relative locations and attributes of phenomena in their everyday or metaphorical spatial environment.	trm_4a3fd79d09d70
3	6	cognitive training	Targeted exercises designed to help improve mental capacities.	trm_51a6905a3f021
4	6	color constancy	the ability to assign stable colors despite variation in light, i.e. identifying that a given box is orange irrespective of the spectral composition or intensity of the light illuminating it	trm_4fea09fac5316
5	6	color perception	The process of distinguishing objects based on the wavelengths of the light they reflect or emit.	trm_4a3fd79d09d93
6	6	color recognition	assigning a detected color stimulus into a category (not necessarily task defined)	trm_557b478ce1c24
7	6	communication	a process by which information is exchanged between individuals through a common system of symbols, signs, or behavior.	trm_4a3fd79d09d9e
8	6	competition	the act or process of competing; active demand by two or more organisms or kinds of organisms for some environmental resource in short supply; a contest between rivals.	trm_4a3fd79d09daa
9	6	comprehension	the act or capacity of understanding	trm_4a3fd79d0b6b9
10	6	concept	"a cognitive unit of meaning—an abstract  idea or a mental symbol  sometimes defined as a ""unit of knowledge,"" built from other units which act as a concept&#39;s characteristics."	trm_4a3fd79d09db6
11	6	concept learning	"Concept learning, also known as category learning and concept attainment, is largely based on the works of the cognitive psychologist Jerome Bruner. Bruner, Goodnow, & Austin (1967) defined concept attainment (or concept learning) as ""the search for and listing of attributes that can be used to distinguish exemplars from non exemplars of various categories."" More simply put, concepts are the mental categories that help us classify objects, events, or ideas and each object, event, or idea has a set of common relevant features. Thus, concept learning is a strategy which requires a learner to compare and contrast groups or categories that contain concept-relevant features with groups or categories that do not contain concept-relevant features.
"	trm_4a3fd79d09dc1
12	6	conceptual category	a way of organizing information, generally derived from experience; they can be part of a hierarchy, as in a taxonomy, or without, as in an alphabet.	trm_4a3fd79d09dcd
13	6	conceptual coherence	combining a set concepts to make sense of a situation or set of situations.	trm_4a3fd79d09dd9
14	6	conceptual metaphor	"In cognitive linguistics, metaphor is defined as understanding one conceptual domain in terms of another conceptual domain; for example, using one person&#39;s life experience to understand a different person&#39;s experience. A conceptual domain can be any coherent organization of experience.

"	trm_4d920c905d465
15	6	conceptual planning	in linguistics, a flexible process of preparation pertaining to grammatical structure of clauses, occurring both before and during production thereof	trm_4a3fd79d09de4
16	6	conceptual priming	Conceptual priming is based on the meaning of a stimulus and is enhanced by semantic tasks. For example, table, will show priming effects on chair, because table and chair belong to the same category.	trm_5521a2aa5b127
17	6	conceptual skill	is the ability to form concepts about abstract and complex ideas such as communication, language, time, and money, for example.	trm_4a3fd79d09df0
18	6	conceptualization	to form a concept of; to interpret.	trm_4a3fd79d09dfc
19	6	conditional reasoning	the reasoner must draw a conclusion based on a conditional, or “if…then,” proposition.	trm_4a3fd79d09e07
20	6	conduct disorder	Lacking regard for others and callous, unemotional.  Characterized by repetitive and persistent pattern of behavior in which the basic rights of others or major age-appropriate norms are violated.	trm_523e00f356226
21	6	cone of confusion	a region around the head for which neither interaural time differences (ITDs) nor interaural loudness differences (ILDs) in a sound are not great enough for a person to localize the sound source	trm_500d8839c2877
22	6	confidence judgment	Assessing the confidence or certainty of a logical reasoning or decision either associated with a behavior or cognition.	trm_55ef153d47bc0
23	6	conflict adaptation effect	"The congruency effect after incongruent trials is reduced when compared with congruent trials. It is a trial-to-trial effect. Originally reported by Gratton, Coles, and Donchin (1992; as refered by van Steenbergen, 2010; Psychological Science). Thus:
(iI-iC) "	trm_5358ede949107
24	6	conflict detection	arises in the presence of concurrently active, mutually exclusive representations	trm_4a3fd79d09e13
25	6	conjunction search	the process of searching for a target that is not defined by any single unique visual feature, but by a combination of two or more features.	trm_4a3fd79d09e1e
26	6	connotation	the suggesting of a meaning by a word apart from the thing it explicitly names or describes; something suggested by a word or thing; the signification of something; an essential property or group of properties of a thing named by a term in logic.	trm_4a3fd79d09e2a
27	6	consciousness	"the quality or state of being aware especially of something within oneself; the state or fact of being conscious of an external object, state, or fact; the state of being characterized by sensation, emotion, volition, and thought; the totality of conscious states of an individual; the normal state of conscious life,(regained consciousness); the upper level of mental life of which the person is aware as contrasted with unconscious processes.
"	trm_4a3fd79d09e35
28	6	consolidation	the process by which a representation becomes stabilized	trm_4a3fd79d0b8cd
29	6	constancy	steadfastness of mind under duress; a state of being constant or unchanging.	trm_4a3fd79d09e58
30	6	constituent structure	"is an analysis, often in the form of a schematic representation, of the constituents of a construction, such as a sentence.
"	trm_4a3fd79d09e64
1	7	context	A set of interrelated conditions in which something exists or occurs (e.g., a style of language in a particular passage, activity of a given regions given sensory input).	trm_4a3fd79d09e6f
2	7	context dependent	"is a class of memory that refers to improved recall of specific episodes or information when the context present at encoding and retrieval are the same.
"	trm_4a3fd79d09e7b
3	7	context memory	refers to improved recall of specific episodes or information when the context present at encoding and retrieval are similar.	trm_4a3fd79d09e87
4	7	contextual knowledge	information, and/or skills that have particular meaning because of the conditions that form part of their description. 	trm_4a3fd79d09e93
5	7	contingency learning	Learning of the contingencies between different events	trm_4a3fd79d09e9e
6	7	contrastive stress	No definition submitted yet	trm_4a3fd79d09eaa
7	7	conventionality	the quality, fact, or condition of being conventional; conventional behavior or act; a conventional form, usage, or rule. 	trm_4a3fd79d09eb6
8	7	convergent thinking	analytical, usually deductive, thinking in which ideas are examined for their logical validity or in which a set of rules is followed.	trm_4a3fd79d09ece
9	7	conversation	An exchange of sentiments, observations, opinions, or ideas.	trm_4a3fd79d09eda
10	7	conversational skill	Ability to engage in appropriate communication of sentiments, observations, opinions, or ideas through dialogue.	trm_4a3fd79d09ee6
11	7	conversational speech	is interactive, more-or-less spontaneous, communication between two or more conversants. Interactivity occurs because contributions to a conversation are response reactions to what has previously been said. Spontaneity occurs because a conversation must proceed, to some extent, and in some way, unpredictably.	trm_4a3fd79d09ef0
12	7	conversational structure	"is the organization of interactive, more-or-less spontaneous, communication between two or more conversants.
"	trm_4a3fd79d09efb
13	7	coordination	is the act of coordinating, making different people or things work together for a goal or effect.  	trm_4a3fd79d09f07
14	7	coproduction	No definition submitted yet	trm_4a3fd79d09f12
15	7	coreference	a relationship between two words or phrases in which both refer to the same person or thing and one stands as a linguistic antecedent of the other.	trm_4a3fd79d09f1e
16	7	covert attention	the act of focusing on one of several sensory stimuli	trm_4feb3ffa1ab51
17	7	creative cognition	"involves two types of processes: generative processes and exploratory processes. 

Generative processes are those that most of us think about when we think of creativity. They are the processes by which creative concepts are first born. These processes are highly visible in extreme acts of creativity, but they are also evident in ordinary, everyday cognition.  Examples (from Ward et al.(cited below)) include memory retrieval, association formation among information retrieved from memory, combinations of structures retrieved from memory, the synthesis of new structures, the transformation of retrieved structures into ""new forms,"" analogical transfer between domains, and ""categorical reduction,"" which involves reducing existing structures to ""more primitive constituents"".  

Exploratory processes are the processes used to explore the structures produced by generative processes. Examples of exploratory processes (given by Ward, et al.) include searching retrieved structures for ""novel attributes,"" searching for ""metaphorical implications,"" searching for possible functions, ""the evaluation of structures from different perspectives or within different contexts,"" interpretation of structures from the perspective of the problem(s) to be solved, and ""the search for various practical or conceptual limitations that are suggested by the structures.""
"	trm_4a3fd79d09f2a
18	7	creative problem solving	the mental process of independently creating a solution to a problem without learned assistance.	trm_4a3fd79d09f36
19	7	creative thinking	the intellectually disciplined process of actively and skillfully conceptualizing, applying, analyzing, synthesizing, and/or evaluating information gathered from, or generated by, observation, experience, reflection, reasoning, or communication, as a guide to belief and action (Scriven & Paul, 1992).	trm_4a3fd79d09f42
20	7	critical period	a limited time in which an event can occur, usually to result in some kind of transformation; in developmental psychology and developmental biology, it is a time in the early stages of an organism&#39;s life during which it displays a heightened sensitivity to certain environmental stimuli, and develops in particular ways due to experiences at this time.	trm_4a3fd79d09f4d
21	7	crossmodal	A complex of two or more modality-specific [unimodal] stimuli	trm_4e31d2241319f
22	7	crosstalk	interference by information presented via multiple channels	trm_4a3fd79d09f59
23	7	crowding	target stimulus is made harder to identify when surrounded by similar non-target stimuli	trm_502c139d5ed78
24	7	crystallized intelligence	the ability to utilize previously acquired knowledge and experience.	trm_4a3fd79d09f64
25	7	cue dependent forgetting	is the failure to recall a memory due to missing stimuli or cues that were present at the time the memory was encoded.	trm_4a3fd79d09f70
26	7	cue validity	the conditional probability that an object falls in a particular category given a particular feature or cue.	trm_4a3fd79d09f7c
27	7	cueing	to give/present a stimulus that prompts a reaction.	trm_4a3fd79d09f87
28	7	curiosity	wanting knowledge or understanding, often of a novel or unfamiliar entity  	trm_4f3bdeedcc99d
29	7	dative shift	a grammatical process by which an oblique  argument of a verb, usually one functioning as a recipient or a benefactive (roles often expressed by datives), is placed in the same grammatical role as a patient, increasing the valency of the verb and forming a clause with two objects.	trm_4a3fd79d0a006
30	7	decay of activation	An explanation for why spreading activation, in network-based models of knowledge representation, peters out as a function of the distance between nodes.	trm_4a3fd79d0a021
1	8	deception	an act to propagate beliefs that are not true, or not the whole truth (as in half-truths or omission).	trm_4a3fd79d0a02c
2	8	decision	The outcome of a process during which a choice is made, usually between several possible options	trm_4a3fd79d0b61f
3	8	decision certainty	confident knowledge regarding the likelihood of an outcome.	trm_557b47abe9a34
4	8	decision making	The deliberate selection of a single alternative amongst multiple alternatives. 	trm_4a3fd79d0a038
5	8	declarative knowledge	"Knowledge that is descriptive and includes knowing ""that"" rather than knowing ""how"" (can be expressed in declarative sentences)."	trm_4a3fd79d0a044
6	8	declarative memory	Memory for facts, and that can be intentionally articulated in some manner.	trm_4a3fd79d0a04f
7	8	declarative rule	A criterion for which one possesses declarative knowledge. Contrasts with an implicit or non-declarative rule, which one might follow but not represent as a rule or even be aware that they are following.	trm_4a3fd79d0a05b
8	8	deductive inference	A type of inference in which the conclusion always follows from the stated premises.If the premises are true, then the conclusion is valid.	trm_4a3fd79d0a066
9	8	deductive reasoning	"is reasoning which constructs or evaluates deductive arguments. Deductive arguments are attempts to show that a conclusion necessarily follows from a set of premises or hypotheses.
"	trm_4a3fd79d0a072
10	8	deep processing	Evaluating a piece of information in terms of meaning or associations to other concepts as opposed to surface or incidental characteristics.	trm_4a3fd79d0a07e
11	8	deep structure	The essential meaning of a sentence, without regard to the grammatical features (surface structure) of the sentence that are needed to express it in words.	trm_4a3fd79d0a08a
12	8	default mode network	"The Default Mode Network (DMN) can be conceptualized as an organized, spontaneous network of neural activity that is modulated during attention-demanding cognition. It consists of a set of brain regions which:
a. are characterized by temporally correlated, low-frequency, spontaneous BOLD signal fluctuations which tend to inversely correlate with fluctuations in other networks, including those that subserve arousal, attention, perception, and working memory;
b. show consistent suppression of activity during most cognitive tasks but increase in activation during certain tasks, including episodic memory retrieval, introspection, and self-referential processing;
c. vary in degree of activation and connectivity related to individual differences in cognition and behavior, including psychopathology and neurological impairment; and,
d. are one of many Intrinsic Connectivity Networks (ICNs) that can be identified in resting-state fMRI and PET analyses."	trm_5159c18bc2e34
13	8	defensive aggression	A response elicited by a real or perceived threat that leads to a pattern of behaviors directed at terminating the threat.	trm_5159c885a7314
14	8	defiance	bold resistance to an opposing force, power, or authority, expressed through behavior and attitude	trm_523e034f9e69a
15	8	deliberation	the process of judging the merits of multiple options, which may then be followed by choice.	trm_4fa28299dbddd
16	8	delusion	A belief held despite appreciable external evidence to the contrary.	trm_4fa3afaeef512
17	8	depth cue	Depth perception arises from a variety of depth cues. These are typically classified into binocular cues that require input from both eyes and monocular cues that require the input from just one eye.  Binocular cues include stereopsis, yielding depth from binocular vision through exploitation of parallax. Monocular cues include size: distant objects subtend smaller visual angles than near objects.  A third class of cues requires synthetic integration of binocular and monocular cues.	trm_4a3fd79d0a095
18	8	depth perception	Ability to perceive the visual world in three dimensions.	trm_4a3fd79d0a0a1
19	8	desire	to long or hope for, exhibit or feel desire for; to express a wish for.	trm_4a3fd79d0a0ad
20	8	detection	to determine the presence of a stimulus	trm_55ce70b20186b
21	8	difference threshold	the smallest detectable difference between two stimuli	trm_4fe9fae4321e7
22	8	diphthong	a gliding monosyllabic speech sound (as the vowel combination at the end of toy) that starts at or near the articulatory position for one vowel and moves to or toward the position of another.	trm_4a3fd79d0a0dc
23	8	discourse	the capacity of orderly thought or procedure, verbal interchange of ideas; formal and orderly and usually extended expression of thought on a subject, connected speech or writing, linguistic unit larger than a sentence.	trm_4a3fd79d0b6c5
24	8	discourse comprehension	Discourse comprehension is the act of interpreting a written or spoken message by integrating the incoming information into the memory or knowledge structures of the interpreter.	trm_4a3fd79d0b6d1
25	8	discourse knowledge	"knowledge regarding discourse
"	trm_4a3fd79d0b6dd
26	8	discourse planning	"the formulation of structures, patterns, mental representations, and processes that constitute the written and spoken unit of connected speech or writing longer than a sentence.
"	trm_4a3fd79d0b6e9
27	8	discourse processing	"is the cognitive process that investigates the structures, patterns, mental representations, and processes that underlie the written and spoken unit of connected speech or writing longer than a sentence.

"	trm_4a3fd79d0b6f5
28	8	discourse production	"the formation of a spoken unit of connected speech or writing longer than a sentence.
"	trm_4a3fd79d0b701
29	8	discrimination	It is the ability to perceive and respond to differences among stimuli.	trm_5519b7525d7a2
30	8	dispositions	Tendency to act in a particular manner given a certain set of antecedents. 	trm_4a3fd79d0a0e7
1	9	distraction	Any event that interrupts a mental process.	trm_4a3fd79d0a0f3
2	9	distributed coding	A type of coding in which the information that constitutes a concept (or mental representation) is spread amongst a number of constituent representations.	trm_4a3fd79d0a0ff
3	9	divergent thinking	a thought process or method used to generate creative ideas by exploring many possible solutions.	trm_4a3fd79d0a10a
4	9	divided attention	A state in which the focus of attention is spread across more than one object or event.	trm_4a3fd79d0a116
5	9	domain specificity	the idea in cognitive science that the mind is divided according to the content of information being processed into specialized, possibly evolved, modules	trm_5021684cba96c
6	9	dream	a succession of thoughts, images, sounds or emotions which the mind experiences during sleep.	trm_4a3fd79d0a12d
7	9	Dyslexia	Dyslexia is a reading impairment. There are currently 17 known types of dyslexia, each resulting from a different component of the reading process, each with different error types and different characteristics. Dyslexia can result from brain damage after reading has been acquired (acquired dyslexia), or can be present from birth (developmental dyslexia).	trm_55e1b08e5b06c
8	9	eating	An individual&#39;s preferences for food or general appetite.	trm_525d8b8908809
9	9	echoic memory	refers to the phenomenon in which there is a brief mental echo that continues to sound after an auditory stimulus has been heard.	trm_4b185801de7a1
10	9	echolocation	the general method of locating objects by determining the time for an echo to return and the direction from which it returns, used by some animals	trm_4a3fd79d0b996
11	9	economic value processing	the process of comparing, at an idiosyncratic level, the economic value of two or more options.	trm_557b4817db34d
12	9	edge detection	a fundamental tool in image processing and computer vision, particularly in the areas of feature detection and feature extraction, which aim at identifying points in a digital image at which the image brightness changes sharply or more formally has discontinuities.	trm_4a3fd79d0b9a1
13	9	efficiency	effective operation as measured by a comparison of production with cost (as in energy, time, money, or cortical activity)	trm_4a3fd79d0a145
14	9	effort	Consciously or intentionally engaging resources in order to achieve a particular end.	trm_4a3fd79d0a151
15	9	effort valuation	Processes by which the cost(s) of obtaining an outcome is computed; tendency to overcome response costs to obtain a reinforcer.	trm_5159c971bf444
16	9	effortful processing	learning or storing (encoding) that requires attention and effort.	trm_4a3fd79d0a15c
17	9	egocentric	A frame of reference centered around the self. In perception, a first-person frame of reference.	trm_4a3fd79d0a168
18	9	elaborative processing	Processing in which semantic associations or relations between words/concepts are generated or elaborated on.	trm_4a3fd79d0a173
19	9	elaborative rehearsal	a type of rehearsal proposed by Craik and Lockhart (1972) in their Levels of Processing model of memory. Elaborative rehearsal involves deep semantic processing of a to-be-remembered item resulting in the production of durable memories.	trm_4a3fd79d0b8d9
20	9	embodied cognition	a theory emphasizing the essentiality of the body&#39;s interaction with the environment to cognition	trm_4f33e65d0daac
21	9	emotion	a complex of psychological phenomena that involve some degree of arousal and valence (positive/negative)	trm_4a3fd79d0a17f
22	9	emotion perception	The process involving understanding feelings with different valences of oneself or of others	trm_4a3fd79d0b65a
23	9	emotion recognition	The process of assigning an emotion to one of the discrete categories of emotion available in a particular culture.	trm_4a3fd79d0b665
24	9	emotion regulation	The ability to have control over and change emotional responses, such as feelings and behaviors associated with them. 	trm_51a690a7492eb
25	9	emotional bonding	"A process of bringing people together based on mutually shared emotions.
"	trm_4a3fd79d0b671
26	9	emotional decision making	The use of affective information as information in a decision making process or as a basis for making a decision. Hot cognition.	trm_4a3fd79d0a18b
27	9	emotional expression	observable verbal and nonverbal behavior that communicates emotion with or without self-awareness.	trm_4a3fd79d0a196
28	9	emotional face recognition	The process of determining whether an emotional face is the same as another face that has been previously encountered.	trm_557b482a7c62b
29	9	emotional intelligence	the capacity, skill or ability to identify, assess, and manage the emotions of one&#39;s self, of others, and of groups.	trm_4a3fd79d0a1a2
30	9	emotional memory	Emotional memory is the storage and recall of events and details that are couple with the physiological response that was present when the event occurred.  	trm_4a3fd79d0a1ae
1	10	emotional mimicry	is the ability of a person to imitate, copy, and experience the physical and emotional characteristics of another persons emotion.  	trm_4a3fd79d0a1b9
2	10	emotional reappraisal	ADD DEFINITION HERE	trm_557b4844ca14d
3	10	emotional self-evaluation	ADD DEFINITION HERE	trm_557b4855a12b4
4	10	emotional suppression	A process to reduce or inhibit the impact of an emotion on ones current conscious state or behavior.	trm_4a3fd79d0a1d1
5	10	empathy	The act of understanding, being aware of, being sensitive to, and or experiencing the feelings, thoughts, and experience of another. 	trm_4a3fd79d0b67d
6	10	encoding	The process of creating a new memory trace.	trm_4a3fd79d0b8e5
7	10	episodic buffer	A theoretical construct that is part of Alan Baddeley&#39;s working memory model and the object of which is to integrate information across sensory domains and communicate with long term memory in the service of working memory. 	trm_4a3fd79d0b8f0
8	10	episodic learning	a change in behavior that occurs as a result of an event; episodic learning is so named because events are recorded into episodic memory.	trm_4a3fd79d0a1e8
9	10	episodic memory	memory of autobiographical events (times, places, associated emotions, and other contextual knowledge) that can be explicitly stated.	trm_4a3fd79d0a1f4
10	10	error detection	Processes that identify when mistakes have been made.	trm_4a3fd79d0a20c
11	10	error signal	An event following error detection, in which a sign is relayed notifying the advent of an error.	trm_4a3fd79d0a218
12	10	error trapping	procedures that detect and correct errors before the errors cause further confusion.	trm_4a3fd79d0a223
13	10	excitation	a state of increased emotional arousal	trm_4a3fd79d0a22f
14	10	executive control	A top-down system that manages and controls other cognitive processes, allowing goal-directed behavior.	trm_4a3fd79d0a246
15	10	executive function	A &#39;top-down&#39; function that manages and controls cognitive processes, allowing goal-directed behavior.	trm_4a3fd79d0a252
16	10	exogenous attention	ADD DEFINITION HERE	trm_56006cb5a61ac
