X	Y	concept	definition	id
1	1	abductive reasoning	The process of adopting an explanatory hypothesis; inferring the cause A as a possible explanation for the consequence B 	trm_4a3fd79d096be
2	1	absolute threshold	the minimum stimulation necessary for a participant to detect a stimulus 50% of the time	trm_4fe9fb5f6a552
3	1	abstract analogy	high-level analogy that retains general information relevant to many specific instances	trm_4a3fd79d096e3
4	1	abstract knowledge	Knowledge that is general and not tied to a specific instance.	trm_4a3fd79d096f0
5	1	acoustic coding	a type of short term memory coding that represents the acoustic properties of the signal	trm_4a3fd79d096fc
6	1	acoustic encoding	the processing and encoding of auditory input for storage and later retrieval.	trm_4a3fd79d09707
7	1	acoustic phonetic processing	"the cognitive ability to discriminate items on the basis of contrasts in sonorance, manner, place, or voicing in auditory stimuli.
"	trm_4a3fd79d09713
8	1	acoustic processing	the extraction of information from signals propagated undersea, in the atmosphere, or in the solid earth in the presence of acoustic noise.	trm_4a3fd79d0971e
9	1	action	the bringing about of an alteration by force or through a natural agency; expression by means of attitude, voice, and gesture; a function of the body or one of its parts; an act of will; a thing done; the accomplishment of a thing usually over a period of time, in stages, or with the possibility of repetition.	trm_4a3fd79d09735
10	1	action initiation	the facilitation or initiation of an act	trm_4a3fd79d0b5c0
11	1	action perception	The ability to perceive the purpose of an action being performed by an animate entity.	trm_5159c00c3dac3
12	1	action selection	The selection of one action from a set of possible actions.	trm_4a3fd79d0b5cb
13	1	activation	the relative engagement of a particular mental representation compared to other representations	trm_4a3fd79d09741
14	1	activation level	quantity or amount of activation	trm_4a3fd79d0974d
15	1	active maintenance	The maintenance of information in working memory through active (volitional) rather than passive means	trm_4a3fd79d0ba0d
16	1	active recall	a principle of efficient learning, which claims the need to actively stimulate memory during the learning process.	trm_4a3fd79d0b8b5
17	1	active retrieval	"Effortful (volitional) attempt to consciously recollect a memory; often required when retrieval cannot be automatically driven by stimuli.
"	trm_4a3fd79d0b8c1
18	1	acuity	accuracy of perception. 	trm_4a3fd79d0b98a
19	1	adaptation	adjustment to environmental conditions; adjustment of a sense organ to the intensity or quality of stimulation; modification of an organism or its parts that makes it more fit for existence under the conditions of its environment. 	trm_4a3fd79d09758
20	1	adaptive control	modifying the control law used by a controller to cope with the fact that the parameters of the system being controlled are slowly time-varying or uncertain.	trm_4a3fd79d09764
21	1	addiction	A phenomenon sometimes conflated and sometimes contrasted with dependency, in which a person has transitioned from liking a rewarding substance or behavior to requiring it.	trm_4fafd1626bf2b
22	1	affect perception	The ability to understand a facial, vocal, or gestural behavior that serves as an indicator of emotion.	trm_4a3fd79d09770
23	1	affect recognition	The ability to understand a physical expression that serves as an indicator of emotion.	trm_4a3fd79d0977b
24	1	agency	The ability to recognize one’s self as the agent of one’s actions and thoughts, including the recognition of one’s own body/body parts.	trm_5154b2f947fe9
25	1	agreeableness	"Agreeableness is a personality trait manifesting itself in individual behavioral characteristics that are perceived as kind, sympathetic, cooperative, warm and considerate.

http://en.wikipedia.org/wiki/Agreeableness"	trm_523f5ee64102c
26	1	altruism	helping others in the absence of an immediately obvious reward.	trm_4a3fd79d097b4
27	1	altruistic motivation	A desire or need to help others driven by selflessness.	trm_4a3fd79d097bf
28	1	alveolar	speech sound articulated with the tip of the tongue touching or near the teethridge.	trm_4a3fd79d097cb
29	1	amodal representation	The way the brain codes multiple inputs such as words and pictures to integrate and create a larger conceptual idea; independent of a particular modality	trm_4a3fd79d097d6
30	1	analog representation	a value or variable in analog form.	trm_4a3fd79d097e2
1	2	analogical encoding	the structural comparison of a familiar with a novel situation	trm_4a3fd79d097ed
2	2	analogical inference	"is the ability to reason by permitting the extension of knowledge of a target domain by virtue of its similarity to a base domain. The general procedure for analogical inference involves copying structure from the base to the target in which missing information is generated, and substitutions are made for items for which analogical correspondences have already been found.
"	trm_4a3fd79d097f9
3	2	analogical problem solving	using principles or concepts from a well-understood situation to solve problems in a new domain or area	trm_4a3fd79d09804
4	2	analogical reasoning	a method of processing information that compares the similarities between new and understood concepts, then uses those similarities to gain understanding of the new concept; a form of inductive reasoning.	trm_4a3fd79d09810
5	2	analogical transfer	The transfer of knowledge from one situation to another by finding a set of one-to-one correspondences between aspects of one body of information and aspects of another.	trm_4a3fd79d0981b
6	2	analogy	inference that if two or more things agree with one another in some respects they will probably agree in others; resemblance in some particulars between things otherwise unlike; correspondence between the members of pairs or sets of linguistic forms that serves as a basis for the creation of another form; correspondence in function between anatomical parts of different structure and origin.	trm_4a3fd79d09827
7	2	anchoring	"a cognitive bias that describes the common human tendency to rely too heavily, or ""anchor,"" on one trait or piece of information when making decisions."	trm_4a3fd79d09833
8	2	anhedonia	lack of interest	trm_52583dceb345e
9	2	animacy decision	ADD DEFINITION HERE	trm_557b471bc6cd8
10	2	animacy perception	The ability to appropriately perceive that another entity is an agent (i.e., has a face, interacts contingently, and exhibits biological motion).	trm_5159beaf80413
11	2	anomaly detection	detecting patterns in a given data set that do not conform to an established normal behavior. 	trm_4a3fd79d0983e
12	2	anticipation	prior expectation of an event or occurrence, sometimes accompanied by an emotional reaction	trm_4a3fd79d09849
13	2	antisocial personality	avoiding the company of other people, unsociable, sometimes to the extent of injuring others or the interests of society in general	trm_523e024c14df9
14	2	anxiety	An aversive psychophysiological state characterized by fear, worry, or concern associated with current or impending threat often elicited by general and specific interoceptive or exteroceptive cues.	trm_5022ef7599294
15	2	apparent motion	The illusory perception that movement is occurring in one or more static images.	trm_4a3fd79d09855
16	2	apperception	the process by which new experience is assimilated to and transformed by the residuum of past experience of an individual to form a new whole.	trm_4a3fd79d0986c
17	2	appetite	the desire to eat food	trm_52583e083c9ab
18	2	appetitive motivation	behavior directed toward goals that are usually associated with positive hedonic processes.  	trm_4a3fd79d09877
19	2	arithmetic processing	numerical calculations or derivation of numbers in response to an input with discrete or continuous salience.	trm_558c7ae1eaf86
20	2	arousal	physiological activation or readiness for activity	trm_4a3fd79d09883
21	2	articulation	the act of vocally producing an utterance or expression	trm_4a3fd79d0988f
22	2	articulatory loop	one of the subsystems postulated in Alan Baddeley’s multicomponent model of WORKING MEMORY, specialized for the temporary storage of verbal information.  It consists of a phonological store and an articulatory rehearsal process. The phonological store can hold speech-based information, subject to a rapid decay. The articulatory rehearsal process can refresh the decaying representation by reading it off and feeding it back to the store. It also serves to convert visually presented information (such as written words) into phonological codes and register them into the phonological store. 	trm_4a3fd79d0ba19
23	2	articulatory planning	The action of coordinating complex tongue and mouth movements in order to produce sound. 	trm_4a3fd79d0989a
24	2	articulatory rehearsal	the process of subvocally repeating material that is to be stored in memory.  	trm_4a3fd79d098a6
25	2	assimilation	the process of receiving new facts or of responding to new situations in conformity with what is already available to consciousness.	trm_4a3fd79d098b2
26	2	association	the process of forming mental connections or bonds between sensations, ideas, or memories.	trm_4a3fd79d098bd
27	2	association learning	learning process in which two or more items or concepts become associated with each other; often used in relation to learned stimulus-response associations	trm_4a3fd79d098c9
28	2	associative priming	"In associative priming, the target is a word that has a high probability of appearing with the prime, and is ""associated"" with it but not necessarily related in semantic features. "	trm_5521a5f310604
29	2	attachment	a social connection between individuals	trm_4a3fd79d098e0
30	2	attended channel	the particular input, out of two or more, that is consciously perceived due to attention.  	trm_4a3fd79d098eb
1	3	attended stimulus	the specific object in the environment on which attention is focused.	trm_4a3fd79d098f7
2	3	attention	used to describe any number of cognitive processes, organized as top-down or bottom-up, goal-directed or stimulus-driven, and more, but generally reflecting an interplay between cognitive and sensory systems.	trm_4a3fd79d09902
3	3	attention capacity	refers to the extent that one can allocate their processing resources.	trm_4a3fd79d0990e
4	3	attention shift	The change that occurs when information that is currently active in the mind is replaced by other information. The information content is typically sensory in nature.	trm_4a3fd79d0b5d7
5	3	attention shifting	The process by which information that is currently relevant in the mind is replaced by other information. This information is typically sensory in nature but may also be semantic.	trm_4a3fd79d0b5fb
6	3	attention span	Amount of time or space that an individual can dedicate to particular task or content without becoming distracted.	trm_4a3fd79d0b5e3
7	3	attentional bias	Attentional bias refers to the tendency for a particular class of stimuli to capture attention. The term is most typically used to refer to biases related to emotional content in bottom-up-capture attention tasks. 	trm_510059e54b2cf
8	3	attentional blink	a phenomenon in which the participant is unable to detect a second salient visual stimulus if presented at the same spatial location within 200-500 milliseconds after the first	trm_4fea1aeaa7b17
9	3	attentional effort	a motivated activation of attention systems in order to stabilize or recover attentional performance in response to the detection of errors and reward loss or, more generally, deteriorating attentional performance; amount of attentional resources needed for a particular situation; engagement of attentional resources	trm_4a3fd79d09919
10	3	attentional focusing	The ability to focus attention on cues in the environment that are relevant to the task in hand; can also include suppression of distracting stimuli	trm_4a3fd79d0b5ef
11	3	attentional resources	amount of available attentional capacity	trm_4a3fd79d09925
12	3	attentional state	referring to amount of attentional resources being engaged;  a relaxed attentional state requires little attentional effort, whereas an alert, focused attentional state requires more	trm_4a3fd79d09930
13	3	attitude	a mental position with regard to a fact or state	trm_4a3fd79d09947
14	3	audiovisual perception	"a single unified awareness derived from the integration of auditory and visual sensory processes when a audiovisual stimulus is present. 

"	trm_4a3fd79d09953
15	3	audition	the sense or act of hearing.	trm_4a3fd79d0995e
16	3	auditory arithmetic processing	numerical calculations or derivation of numbers in response to an auditory input with discrete or continuous salience.	trm_55b6b8e291dba
17	3	auditory attention	"is the cognitive process of selectively concentrating on one auditory stream in the environment while ignoring others.
"	trm_4a3fd79d09a10
18	3	auditory coding	processing and encoding of sound, words, and all other auditory input for storage and later retrieval. According to Baddeley, processing of auditory information is aided by the concept of the phonological loop, which allows input within our echoic memory.	trm_4a3fd79d09a3d
19	3	auditory encoding	the process of storing auditory information in memory.  	trm_4a3fd79d09a49
20	3	auditory feedback	"is provided by auditory stimulation in response to specific behavior. The feedback may be used to amend subsequent behavior, cognition, perception or performance.
"	trm_4a3fd79d09a55
21	3	auditory grouping	joining disparate sounds together into one percept; assessing which acoustic streams belong together	trm_4a3fd79d09a61
22	3	auditory imagery	the subjective experience of hearing in the absence of auditory stimulation.	trm_4a3fd79d09a6c
23	3	auditory learning	learning of auditorily presented information	trm_4a3fd79d09a78
24	3	auditory lexical access	"The process by which the basic sound-meaning connections of language, i.e., lexical entries, are activated.
"	trm_4a3fd79d09a84
25	3	auditory localization	a listener&#39;s ability to identify the location or origin of a detected sound.	trm_4a3fd79d09a8f
26	3	auditory masking	the perception of one sound is affected by the presence of another sound; presenting a sound to interfere with or terminate a target sound	trm_4a3fd79d09a9b
27	3	auditory memory	the cognitive capacity of storing and retrieving information related to sound.	trm_4a3fd79d09aa7
28	3	auditory perception	The ability to identify, interpret, and attach meaning to sound.	trm_4a3fd79d09ab2
29	3	auditory recognition	assigning a detected sound stimulus into a category (not necessarily task defined)	trm_55ef687f48a9d
30	3	auditory scene	auditory scene analysis is the process by which the human auditory system organizes sound into perceptually meaningful elements.	trm_4a3fd79d09abe
1	4	auditory scene analysis	the process by which the human auditory system organizes sound into perceptually meaningful elements.	trm_4a3fd79d09aca
2	4	auditory sentence comprehension	ability to combine auditory words into a meaningful sentence unit. 	trm_4a3fd79d09ad5
3	4	auditory sentence processing	takes place whenever a listener cognitively processes a sentence.	trm_55b6b89222d4c
4	4	auditory sentence recognition	assigning an detected sound stimulus in the form of a sentence into a category (not necessarily task defined)	trm_558c7b14c076e
5	4	auditory stream segregation	the perceptual grouping of sounds to form coherent representations of objects in the acoustic scene; a fundamental aspect of hearing and speech perception.	trm_4a3fd79d09ae1
6	4	auditory tone detection	determining the presence of an auditory stimulus such as a sound or tone	trm_557b474e2b578
7	4	auditory tone discrimination	It is the ability to perceive and respond to differences among auditory stimuli	trm_557b476527a27
8	4	auditory tone perception	perception of an auditory tone	trm_55ef273a77a86
9	4	auditory word comprehension	ability to parse acoustic signals into meaningful words	trm_4a3fd79d09aed
10	4	auditory word recognition	ability to recognize acoustically presented words	trm_4a3fd79d09af8
11	4	auditory working memory	Working memory for auditory information	trm_4a3fd79d09b04
12	4	autobiographical memory	a memory system consisting of episodes recollected from an individual’s life, based on a combination of episodic (personal experiences and specific objects, people and events experienced at particular time and place) and semantic (general knowledge and facts about the world) memory.	trm_4a3fd79d09b10
13	4	autobiographical recall	episodes recollected from an individual’s life, based on a combination of episodic (personal experiences and specific objects, people and events experienced at particular time and place) and semantic (general knowledge and facts about the world) memory. 	trm_4a3fd79d09b1c
14	4	automaticity	behavior performed without intention	trm_4a3fd79d09b28
15	4	autonoesis	consciousness of self consistent over time, both in imagining the future and recalling the past; consciousness of subjectivity	trm_4ff1fc04e22e8
16	4	availability heuristic	A heuristic in which people predict the frequency of classes or the probability of events based on the ease with which relevant instances come to mind. 	trm_4a3fd79d09b33
17	4	aversive learning	behavior modification using an adverse stimulus in response to the inappropriate or undesirable behavior.	trm_4a3fd79d09b3f
18	4	awareness	having knowledge or cognizance. 	trm_4a3fd79d09b4b
19	4	backward chaining	an inference method used in automated theorem provers, proof assistants and other artificial intelligence applications.  Backward chaining starts with a list of goals (or a hypothesis) and works backwards from the consequent to the antecedent to see if there is data available that will support any of these consequents.	trm_4a3fd79d09b62
20	4	balance	Balance allows humans to be able to orient the body in space, maintain an upright posture under static and dynamic conditions, and move without falling, by adjusting motoric control	trm_50eb56a7867db
21	4	behavioral inhibition	Disambiguation	trm_4a3fd79d09b79
22	4	behavioral inhibition (cognitive)	"Often used as a synonym of ""response inhibition"" to describe the inhibition of actions.
"	trm_4b7c270940f9d
23	4	behavioral inhibition (temperament)	A temperamental characteristic described by shyness and social anxiety.	trm_4b7c27094a093
24	4	belief	a state or habit of mind in which trust or confidence is placed in some person or thing; conviction of the truth of some statement or the reality of some being or phenomenon especially when based on examination of evidence.	trm_4a3fd79d09b85
25	4	binocular convergence	"when you look at an object that is closer than approximately 25 feet, your eyes must converge on the object to perceive it as a single object clearly in focus."" "	trm_4a3fd79d09b9c
26	4	binocular depth cue	a cue that provides depth information about a scene when it is viewed with both eyes	trm_4fea04a02ce37
27	4	binocular disparity	the difference in image location of an object seen by the left and right eyes, resulting from the eyes&#39; horizontal separation. The brain uses binocular disparity to extract depth information from the two-dimensional retinal images  in stereopsis.	trm_4a3fd79d09bb3
28	4	binocular rivalry	competition between the eyes for control of perception, particularly evident when different stimuli are presented to each eye	trm_500d8626d0770
29	4	binocular vision	is vision in which both eyes are used together.  Having two eyes confers at least four advantages over having one. First, it gives a creature a spare eye in case one is damaged. Second, it gives a wider field of view.  Third, it gives binocular summation in which the ability to detect faint objects is enhanced.  Fourth it can give stereopsis in which parallax provided by the two eyes&#39; different positions on the head give precise depth perception.  Such binocular vision is usually accompanied by singleness of vision or binocular fusion, in which a single image is seen despite each eye&#39;s having its own image of any object.  Other phenomena of binocular vision include utrocular discrimination, eye dominance, allelotropia, and binocular rivalry.	trm_4a3fd79d09bbf
30	4	bitterness	being or inducing the one of the four basic taste sensations that is peculiarly acrid, astringent, or disagreeable; marked by intensity or severity; marked by cynicism and rancor; intensely unpleasant especially in coldness or rawness; expressive of severe pain, grief, or regret.	trm_4a3fd79d09bcb
1	5	blindsight	unconscious visual perception, i.e. a phenomenon in which people can detect, discriminate between, and respond to visual stimuli without being consciously aware of them	trm_5029515e29f7f
2	5	body maintenance	keeping information about the body in active and immediately accessible state.	trm_557b477b4a15f
3	5	body orientation	perception of the orientation of the body overall relative to other objects in the environment	trm_4a3fd79d09be2
4	5	body representation	A mental representation of one&#39;s own body	trm_4e5505361f160
5	5	border ownership	the determination of a local feature (i.e. a contrast edge or line) and the object to which it belongs	trm_502ab8dd991bf
6	5	capacity limitation	a limitation on the capacity to process information	trm_4a3fd79d09bee
7	5	case based reasoning	the process of solving new problems based on the solutions of similar past problems.	trm_4a3fd79d09bf9
8	5	categorical clustering	the clustering of recalled items based on category membership	trm_4a3fd79d09c05
9	5	categorical knowledge	"knowledge about different attributes and uses of an object that allows it to be placed in a group of objects with similar attributes and uses.
"	trm_4a3fd79d09c11
10	5	categorical perception	A form of perception in which the individual perceives a categorical distinction rather than a continuous scale of a varying perceptual feature.  	trm_4a3fd79d09c1c
11	5	categorization	The assignment of a stimulus to one of a set of categories	trm_4a3fd79d09c28
12	5	category based induction	requires that information about one set of categories is used to infer something about another category. A set of premises establishes that one or more categories possess a certain property.  The premises are followed by an assertion (the conclusion) that a target category also possesses that property. 	trm_4a3fd79d09c34
13	5	category learning	"is a strategy which requires a learner to compare and contrast groups or categories that contain concept-relevant features with groups or categories that do not contain concept-relevant features.
"	trm_4a3fd79d09c3f
14	5	causal inference	The process of inferring that one state/object/event causes the occurrence of another state/object/event.	trm_4a3fd79d09c5b
15	5	central attention	is the cognitive process that allows one to focus on the most important and relevant train of thought that needs to be attended to in a specific situation.	trm_4a3fd79d09c69
16	5	central coherence	a person&#39;s ability to understand things in context, frequently described as a deficit in literature on autism	trm_4b82c75498408
17	5	central executive	Theoretical &#39;top-down&#39; cognitive system responsible for the management of executive functions including planning, working memory, attention, problem solving, reasoning, inhibition, multi-tasking, and the initiation and monitoring of actions.	trm_4a3fd79d0ba25
18	5	centration	the tendency to focus on one aspect of a situation and neglect others.	trm_4a3fd79d09c74
19	5	change blindness	the inability to detect changes to an object or a scene even if large, repeatedly made, or anticipated; it can even occur when the subject is fixated on the item being changed.	trm_4fea238758d33
20	5	chemonociception	perception of stimulation by noxious chemical agents	trm_4a3fd79d09c80
21	5	chromatic contrast	When a small patch is surrounded by a color field, the patch appears to be tinted in the opponent color of the surrounding field.	trm_4a3fd79d09c97
22	5	chunk	Structure in memory that is used as a unit of knowledge representation. Also refers to the process of learning by which these units are acquired.	trm_4a3fd79d09ca3
23	5	chunking	"The process of recoding information by splitting or reorganizing it into smaller parts. 
Actually: combining several smaller items into a larger ""group"" item, i.e.: 3 separate ""incoming aircraft"" considered as ""3 incoming aircraft"". Significantly reduces the working memory space used. Likely concept model for computer programming data-forms that list pointers to numerous specific data. Larger classes of concepts include: Learning and Memory, Attention, Action (Planning), Executive Control."	trm_4a3fd79d09cae
24	5	circadian rhythm	Endogenous, self-sustaining oscillations that organize the timing of biological systems to optimize physiology, behavior, and health. Circadian rhythms are synchronized by recurring environmental cues and attempt to anticipate the external environment. They also modulate homeostasis within the brain and other systems, tissues, and organs. 	trm_5159c382bd8d4
25	5	cognition	The process of thought; includes all psychological/mental functions that allow for subsequent reflection given some information.	trm_4a3fd79d09d29
26	5	cognitive control	The top-down modulation of cognitive processes based on higher-order representations such as goals or plans.	trm_4aae62e4ad209
27	5	cognitive development	the construction of thought processes, including remembering, problem solving, and decision-making, from childhood through adolescence to adulthood.	trm_4a3fd79d09d35
28	5	cognitive dissonance	The mental state in which a person holds multiple conflicting ideas simultaneously	trm_4a3fd79d09d41
29	5	cognitive effort	Consciously or intentionally engaging cognitive resources in order to achieve a particular end.	trm_4a3fd79d09d4d
