X	Y	concept	definition	id
27	20	rapid reacquisition	following extinction, when reacquisition of responding to previous CS is more rapid than acquisition with a novel CS	trm_50240210a9902
28	20	reading	Decoding symbols to derive their meaning.	trm_4a3fd79d0aeb6
29	20	reasoning	drawing of inferences or conclusions through the use of reason.	trm_4a3fd79d0aec1
30	20	recall	The process of retrieving previously stored information, done without the aid of external cues.	trm_4a3fd79d0b95b
1	21	reception of facial communication	The capacity to perceive someone’s emotional state non-verbally based on facial expressions. Examples include affect recognition, facial recognition and characterization.	trm_5154a9f45903f
2	21	Reception of non-facial communication	The capacity to perceive social and emotional information based on modalities other than facial expression, including non-verbal gestures, affective prosody, distress calling, cooing, etc.	trm_5154b049c279f
3	21	recognition	assigning a detected stimulus into a category (not necessarily task defined)	trm_4a3fd79d0b967
4	21	reconsolidation	the process of previously consolidated memories being recalled and actively consolidated, it is a distinct process that serves to maintain, strengthen and modify memories that are already stored in the long-term memory.	trm_4a3fd79d0b972
5	21	regret	an emotional response to remembrance of a past state, condition, or experience that one wishes had been different	trm_4a3fd79d0aecd
6	21	rehearsal	The repetition of information in an attempt to maintain it longer in memory.	trm_4a3fd79d0ba54
7	21	rehearsal loop	or phonological loop, also called the phonetic loop or the articulatory loop, is the part of working memory that rehearses verbal information. It consists of two parts: a short-term phonological store with auditory memory traces that are subject to rapid decay and an articulatory rehearsal component that can revive the memory traces.The first component is a phonological memory store which can hold traces of acoustic or speech based material. Material in this short term store lasts about two seconds unless it is maintained through the use of the second subcomponent, articulatory subvocal rehearsal. Prevention of articulatory rehearsal results in very rapid forgetting (a process known as decay). 	trm_4a3fd79d0ba60
8	21	reinforcement learning	ADD DEFINITION HERE	trm_557b4993a0fdd
9	21	reinstatement	following extinction, conditioned response returns after exposure to unconditional stimulus (US) alone	trm_502403240a2a2
10	21	relational comparison	Comparison of two stimuli based on a relational feature	trm_555cfb890d721
11	21	relational learning	learning to differentiate among stimuli on the basis of relational properties (e.g., the larger of two stimuli) rather than absolute properties (e.g., the stimulus that has a given size).	trm_4a3fd79d0aed8
12	21	remembering	the process of consciously reviving or bringing to awareness previous events, experiences, or information. Remembering also involves the process of retaining such material, which is essential to learning. Remembering is distinct from knowing.	trm_4a3fd79d0b97e
13	21	remote memory	memory for events of long ago as opposed to recent events.	trm_4a3fd79d0aee4
14	21	renewal	following extinction, change of context causes a return of conditioned responding	trm_5023eccc628b3
15	21	Repetition priming	refers to the finding that an initial presentation of a stimulus influences the way in which an individual will respond to that stimulus when it is presented at a later time.	trm_5521a45a397a6
16	21	representation	It is the mental imagery of things such as objects, events and settings that are not currently seen or sensed by the sense organs	trm_5519b384d446c
17	21	repressed memory	A memory (often traumatic) that is unavailable for recall.	trm_4a3fd79d0aeef
18	21	resistance to distractor inference	ADD DEFINITION HERE	trm_557b499fac085
19	21	resource	any aspect of cognition having bounded availability, eg. memory, attention	trm_4f3a72a028d90
20	21	resource limit	the maximum amount of cognitive resources that can be allocated to various, often competing tasks	trm_4a3fd79d0af4c
21	21	resource sharing	"is a unique characteristic of humans and several primates that involve sharing resources such as food, shelter, etc., as a collective risk-reduction against variability in resource supply.
"	trm_4a3fd79d0af5a
22	21	response bias	"A behavioral phenomena for which a participant in an experiment is biased to respond in a particular way.

** Concepts in the Cognitive Atlas that are more behavioral in nature should be tagged as ""behavioral phenomena"""	trm_559f0a129c136
23	21	response conflict	ADD DEFINITION HERE	trm_557b49ad14adf
24	21	response execution	Performance of an action in accordance with task demands, enacting a specific overt behavior	trm_557b4a7315f1b
25	21	response inhibition	Suppression of actions that are inappropriate in a given context and that interfere with goal-driven behavior.	trm_4a3fd79d0af66
26	21	Response priming	denotes a special form of visuomotor priming effect in which prime and target are presented in quick succession	trm_5521a663cd89c
27	21	response selection	The selection of one action from a limited set of possible actions.	trm_4a3fd79d0af71
28	21	restricted behavior	A restricted behavior is a stereotyped pattern of behavior, activity, or interest. Examples include preoccupation with an object, activity, or topic, and this preoccupation is abnormal in intensity or focus.  Individuals with restricted behaviors may find it challenging to break away from habit or routine.	trm_52068e5bd9aa1
29	21	retention	"a preservation of the aftereffects of experience and learning that makes recall or recognition possible.
Persistence of learned behavior or experience during a period when it is not being performed o r practiced.
Retention is the second stage of memory after encoding and before retrival"	trm_4a3fd79d0af7d
30	21	retrieval	"The process of accessing information from memory or other storage devices; the possibility of recovery, restoration, or rectification.
Retrieval is the third stage of memory after encoding and retention."	trm_4a3fd79d0af94
1	22	retrieval cue	An event or experience that facilitates retrieval of information from long-term memory because of its association to that information.	trm_4a3fd79d0afa0
2	22	retroactive interference	impeded retrieval and performance of previously learnt information due to newly acquired and practiced information.	trm_4a3fd79d0afab
3	22	reward	A positive return for performance of a specific behavior.	trm_4b6525253c63f
4	22	reward anticipation	prior expectation of the occurrence of a reward, sometimes accompanied by an emotional reaction 	trm_557b4a81a4a17
5	22	reward learning	A process by which organisms acquire information about stimuli, actions, and contexts that predict positive outcomes, and by which behavior is modified when a novel reward occurs or outcomes are better than expected. Reward learning is a type of reinforcement learning, and similar processes may be involved in learning related to negative reinforcement.	trm_5159cb12a0f92
6	22	reward valuation	Processes by which the probability and benefits of a prospective outcome are computed and calibrated by reference to external information, social context (e.g., group input, counterfactual comparisons), and/or prior experience. This calibration is influenced by pre-existing biases, learning, memory, stimulus characteristics, and deprivation states. Reward valuation may involve the assignment of incentive salience to stimuli.	trm_5159c94667677
7	22	rhythm	Movement marked by the regulated succession of strong and weak elements, or of opposite or different conditions.  While rhythm most commonly applies to sound, such as music and spoken language, it may also refer to visual presentation, as timed movement through space.	trm_4a3fd79d0afc3
8	22	right finger response execution	Performance of an action using the right finger in accordance with task demands.	trm_55b6b910b4b23
9	22	right hand response execution	Performance of an action with the right hand in accordance with task demands.	trm_558c7b337080f
10	22	right toe response execution	Performance of an action using the right toe in accordance with task demands.	trm_55b6b952c1b4c
11	22	rigidity	unable to stray from a particular pattern of behavior or thought	trm_523e0a4b443dc
12	22	risk	"Formally and mathematically speaking, the minimal definition of risk is what (Rothschild and Stiglitz, 1970) call a mean-preserving increase in dispersion. A typical example is a gamble offering $400 or $600 based on the outcome of a coin flip (i.e. with equal probability (50%)); this is less risky as compared to a similar gamble offering $200 or $800 [again depending on the outcome of a coin flip]. Notice here that the mean outcome (or “expected value”) remains the same for both gambles.

Thus risk can increase by keeping both the probabilities and the expected value the same. 

There are other approaches to risk that are less mathematically stringent but have higher ecological validity. For instance increasing the probability of a (positive outcome) is associated with a reduced perception of risk. Notice though now that the expected value (or the mean outcome) also increases. So, it is difficult in that case to disentangle the two metrics.

Many times  the term risk is associated with the probability of a negative outcome, or what is formally called downside risk. This idea is mostly due to the way actuarial science and insurance companies (which are more interested in the negative aspects of risk) use the term. For instance, the statement, “now we increase the risk,” might be translated as taking more perilous actions, but formally, this is not the case. The point of risk is that the opportunity also increases (“upside” risk). Thus, a situation that is riskier can be attractive, especially if the agent focuses on the positive outcomes.

Another approach is the so-called “moment-based” approach. Here, one is interested in the second or higher moments of a distribution, roughly corresponding to variance, skewness and kurtosis. Skewness is of particular interest because it seems that risk-seeking persons (gamblers) can be attracted by positively skewed outcomes. Bets that offer a small probability of a high outcome are  attractive to gamblers (Garrett and Sobel, 1999).

Overall, risk is not a unitary concept and should be very carefully defined.

Note that the term risk as used here should be distinguished from the way the term is used in sentences such as ""risk of developing Parkinson&#39;s disease"". An epidemiologist could help on the definition in that context.

Input by other contributors:
the probability or likelihood that an event will occur; possibility of loss or injury; someone or something that creates or suggests a hazard; the chance that an investment will lose value."	trm_4a3fd79d0afcf
13	22	risk aversion	when exposed to uncertainty, behavior that attempts to reduce that uncertainty. 	trm_55ce71c47f37b
14	22	risk processing	the extraction of information about the potential or current threat of a stimuli.	trm_557b4a913f8cc
15	22	risk seeking	The willingness of an individual to choose an option with a less-than-certain probability of reward over an option with a certain reward of equal or higher expected value. 	trm_4a3fd79d0b64e
16	22	route knowledge	is represented as a series of directions to follow to get from one place to another.	trm_4a3fd79d0afda
17	22	routine	a regular course of procedure; habitual or mechanical performance of an established procedure; a reiterated speech or formula; a sequence of computer instructions for performing a particular task.	trm_4a3fd79d0afe6
18	22	rule	a method for performing a psychological operation	trm_4a3fd79d0aff2
19	22	rule learning	process in which a participant gradually acquires knowledge about a fixed but unstated standard that defines, for example, the acceptability of a response or membership of category	trm_4a3fd79d0affd
20	22	sadness	an emotion  characterized by feelings of unhappiness, disadvantage, loss, and helplessness.	trm_4a3fd79d0b014
21	22	salience	a parameter of a stimulus that indexes its effectiveness.	trm_4a3fd79d0b020
22	22	schema	a structured representation that includes a particular organized way of perceiving and responding to a complex situation or set of stimuli.	trm_4a3fd79d0b02c
23	22	search	to look into or over carefully or thoroughly in an effort to find or discover something; to look through or explore by inspecting possible places of concealment or investigating suspicious circumstances; to look at as if to discover or penetrate intention or nature; to uncover, find, or come to know by inquiry or scrutiny.	trm_4a3fd79d0b037
24	22	selective attention	When multiple external sensory inputs are present, the process of dedicating cognitive and perceptual resources to one type/set of input and attenuating receptiveness to other inputs.	trm_4a3fd79d0b043
25	22	selective control	ADD DEFINITION HERE	trm_557b4aa070c10
26	22	self control	The effortful control of behaviors, thoughts, or emotions with the aim of increasing the likelihood of attaining long-term over short-term outcomes.	trm_4ee8facd77dfc
27	22	self knowledge	The ability to make judgments about one’s current cognitive or emotional internal states, traits, and/or abilities.	trm_5154b39a3193d
28	22	self monitoring	monitoring of one&#39;s own behavior.	trm_4a3fd79d0b05e
29	22	self talk	overt verbalisation of thoughts for the purpose of self motivation, problem solving, reasoning, learning or stress management; a behavior commonly witnessed in sports-people during moments of performance pressure 	trm_4f4672db34a46
30	22	semantic categorization	The assignment of a semantic stimulus to one of a set of categories.	trm_557b4ab076338
1	23	semantic category	"is a grouping of vocabulary within a language, organizing words which are interrelated and define each other in various ways. Also referred to as a semantic field.

"	trm_4a3fd79d0b06b
2	23	semantic information	information that is not tied to any specific object, event, domain, or application. It includes general factual information about the world (as in an encyclopedia) and oneself.	trm_4d2201d530697
3	23	semantic knowledge	long-established knowledge about objects, facts, and word meanings.	trm_4a3fd79d0b077
4	23	semantic memory	refers to one&#39;s conceptual knowledge and includes the meanings of words, factual information about the world, and other information not related to specific events or episodes	trm_4a3fd79d0b083
5	23	semantic network	Set of concepts and relations	trm_51838baad343e
6	23	Semantic priming	"is where we process stimuli better depending on what comes first.
"	trm_5521a51034353
7	23	semantic processing	"refers to the cognitive processing of the meanings of a stimulus
"	trm_4a3fd79d0b87a
8	23	semantic working memory	Working memory for meaning	trm_4a3fd79d0b08f
9	23	sense of body ownership	The feeling that something is part of one&#39;s own body.	trm_4e5faabfe8ce3
10	23	sense of ownership	The feeling that something is part of one self.	trm_4e5badf095692
11	23	sensitivity to change	an individual&#39;s ability to withstand changes in his or her environment or situation.	trm_525d8e198e0da
12	23	sensory defensiveness	"a condition defined as having ""a tendency to react negatively or with alarm to sensory input which is generally considered harmless or non-irritating"" to neurotypical people."""	trm_525d8cd1c9cc3
13	23	sensory memory	brief storage of sensory information in each of the senses, which temporarily holds material (e.g., a perceptual experience) for recoding into another memory (such as short-term memory) or for comprehension.	trm_4a3fd79d0b09a
14	23	sentence comprehension	takes place whenever a reader or listener processes a language utterance, either in isolation or in the context of a conversation or a text.	trm_4a3fd79d0b892
15	23	sentence processing	"takes place whenever a reader or listener cognitively processes a language utterance, either in isolation or in the context of a conversation or a text.
"	trm_4a3fd79d0b89e
16	23	sentence production	The creation and/or utterance of a sentence	trm_4a3fd79d0b8aa
17	23	sequence learning	learning of a sequence of items or responses in the precise order of their presentation.	trm_4a3fd79d0b0a6
18	23	serial learning	The process of acquiring information in sequence and following an order that must be preserved at recall.	trm_4a3fd79d0b0b1
19	23	serial processing	information processing in which only one sequence of processing operations is carried on at a time.	trm_4a3fd79d0b0bd
20	23	serial search	The process of identifying a target within a set of candidate elements by testing the identity of each element against the identity of the sought after target one at a time.	trm_4a3fd79d0b0c8
21	23	set shifting	disengagement of an irrelevant task set and subsequent engagement of a relevant task set despite interference and/or priming	trm_4a3fd79d0b607
22	23	shallow processing	a mode of thinking in which one pays attention only to appearances and other superficial aspects of the material, typically leading to poor memory retention.	trm_4a3fd79d0b0df
23	23	shame	a painful emotion caused by consciousness of guilt, shortcoming, or impropriety; a condition of humiliating disgrace or disrepute; something that brings censure or reproach.	trm_4a3fd79d0b0eb
24	23	shape recognition	the ability to perceive a shape	trm_553967f006b70
25	23	short term memory	A limited-capacity and short-lasting representation of information in the mind. The duration of short-term memory is on the order of seconds, while its capacity is on the order of 4 to 9 independent items.	trm_4a3fd79d0b0f7
26	23	skepticism	an attitude of doubt or a disposition to incredulity either in general or toward a particular object.	trm_4a3fd79d0b10e
27	23	skill	 Proficiency, facility, or dexterity that is acquired or developed through training or experience.	trm_4a3fd79d0b11a
28	23	skill acquisition	The process of learning to perform a task or set of tasks with increasing facility. Typically implies the formation of procedural (as distinct from semantic or episodic) memories.	trm_4a3fd79d0b125
29	23	sleep	Sleep and wakefulness are endogenous, recurring, behavioral states that reflect coordinated changes in the dynamic functional organization of the brain and that optimize physiology, behavior, and health. Homeostatic and circadian processes regulate the propensity for wakefulness and sleep. Sleep is a reversible state, characterized by postural recumbence, behavioral quiescence, and reduced responsiveness. It involves predictable cycling of non-rapid eye movement (NREM) and rapid eye movement (REM). It is affected by experiences during wakefulness, and has restorative and transformative effects that optimize neurobehavioral functions during wakefulness.	trm_5159c70d0e98e
30	23	social cognition	the encoding, storage, retrieval, and processing, in the brain, of information relating to conspecifics, or members of the same species.	trm_4a3fd79d0b13d
1	24	social context	the identical or similar social positions and social roles as a whole that influence the individuals of a group.	trm_4a3fd79d0b148
2	24	social inference	write definition here	trm_5595be14a57c5
3	24	social intelligence	the ability to function successfully in interpersonal situations.	trm_4a3fd79d0b154
4	24	social motivation	An individual&#39;s tendency to seek out direct contact with another person or a group of people.	trm_52090251db8c8
5	24	social phobia	having a fear so strong of being judged by others and of being embarrassed that it significantly gets in the way of everyday life	trm_523e053844495
6	24	somatosensation	the components of the central and peripheral nervous systems that receive and interpret sensory information from organs in the joints, ligaments, muscles, and skin. This system processes information about the length, degree of stretch, tension, and contraction of muscles; pain; temperature; pressure; and joint position.	trm_4a3fd79d0b160
7	24	source memory	the episodic source from which a specific item was acquired (e.g., from a person, a book, or television (Schacter, Kaszniak, Kihlstrom, & Valdiserri, 1991, p. 559).	trm_4a3fd79d0b18f
8	24	source monitoring	The process of identifying the the source or context at acquisition of information that has been stored in memory.	trm_4a3fd79d0b19b
9	24	spatial ability	skill in perceiving the visual world, transforming and modifying initial perceptions, and mentally recreating spatial aspects of one&#39;s visual experience without the relevant stimuli.	trm_4a3fd79d0b1a6
10	24	spatial attention	The allocation or prioritization of mental resources based on spatial coordinates (with respect to the body, head etc).	trm_4a3fd79d0b1b2
11	24	spatial cognition	the acquisition, organization, utilization, and revision of knowledge about spatial environments.	trm_4a3fd79d0b1bd
12	24	spatial localization	it is the reference of a visual sensation to a definite locality in space	trm_5519bb7767d98
13	24	spatial memory	the part of memory  responsible for recording information about one&#39;s environment and its spatial orientation.	trm_4a3fd79d0b1d5
14	24	spatial selective attention	The process of dedicating cognitive and perceptual resources to one or more spatial inputs and attenuating receptiveness to other inputs. 	trm_557b4abe521af
15	24	spatial working memory	The ability to maintain online information that relates to space. This process has limited capacity and its contents are not stored permanently.	trm_4a3fd79d0b1e0
16	24	speech perception	the process by which the sounds of language are heard, interpreted and understood. 	trm_4a3fd79d0b1f7
17	24	speech processing	the processing of speech signals	trm_4a3fd79d0b238
18	24	speech production	"is the process by which spoken words are selected to be produced, have their phonetics formulated and then finally are articulated by the motor system in the vocal apparatus. Speech production can be spontaneous such as when a person creates the words of a conversation, reaction such as when they name a picture or read aloud a written word, or a vocal imitation such as in speech repetition.  Speech production is not the same as language production since language can also be produced manually by signs.
"	trm_4a3fd79d0b247
19	24	spontaneous recovery	recovery of a conditioned response following extinction, simply as a function of time	trm_5024002a85b1f
20	24	spreading activation	"a method for searching associative networks, neural networks, or semantic networks; the search process is initiated by labeling a set of source nodes (e.g. concepts in a semantic network) with weights or ""activation"" and then iteratively propagating or ""spreading"" that activation out to other nodes linked to the source nodes."	trm_4a3fd79d0b26d
21	24	stereopsis	the process in visual perception leading to the sensation of depth from the two slightly different projections of the world onto the retinas of the two eyes.	trm_4a3fd79d0b279
22	24	stereotypes	something conforming to a fixed or general pattern; a standardized mental picture that is held in common by members of a group and that represents an oversimplified opinion, prejudiced attitude, or uncritical judgment.	trm_4a3fd79d0b285
23	24	stimulus detection	It is the ability to discern between information-bearing patterns and random patterns that distract from the information	trm_5519b80525e89
24	24	story comprehension	WRITE DEFINITION HERE	trm_55c6f58e77fbe
25	24	strategy	A plan of action designed to achieve a particular goal.	trm_4a3fd79d0b29c
26	24	Strength	Strength refers to a muscle&#39;s ability to generate force against physical objects.	trm_50eb5469ba37a
27	24	stress	"refers to the consequence of the failure of an organism – human or animal – to respond appropriately to emotional or physical threats, whether actual or imagined.
"	trm_4a3fd79d0b2a8
28	24	string maintenance	The process of keeping string (e.g., consonant)  information in active and immediately accessible state.	trm_557b4acdee820
29	24	subconscious	"Subconscious is any neural activity which has the potential to be conscious, but at the moment is processed below the level of consciousness.

In contrast to unconscious information processing, subconscious processing contains meaning (semantic information).

Intuition is a good example for subconscious information processing. In other words, intuition means thinking below the level of consciousness whereby only the output enters the stream of consciousness.

from Peter Walla"	trm_4d21e9a7dd8ca
30	24	subjective food value	Subjective food value is used as term to indicate a food&#39;s worth, based on an individuals&#39; current desires and needs (e.g., hunger). Subjective food value assessment is an intermediate  step during food decision making. 	trm_559f09a5cdca9
1	25	subjective value judgment	the process of comparing, at an idiosyncratic level, the relatively desirability of two or more options or the internal idiosyncratic value represented internally for such a judgement 	trm_558c736199abd
2	25	sublexical route	is a theoretical component of Coltheart&#39;s dual-route reading model that refers to using spelling-to-sound correspondences to convert a written word (i.e. orthography) into a spoken word (i.e. phonology).  In other words, it is the route by which letters are linked to their sounds and the sounds are assembled into a whole word pronunciation.  It complements the lexical route where the whole word is recognized and linked to its sound.	trm_4a3fd79d0b2b4
